{
  "schema_version": "1.1",
  "title": "Synthetic paper, objective, worked and diagram sections",
  "course_code": "SYN-OBJ",
  "exam_code": "",
  "subject_id": "00000000-0000-4000-8000-000000000001",
  "duration_minutes": 90,
  "total_marks": 30,
  "negative_marking": 0.25,
  "mark_step": 0.5,
  "sections": [
    {
      "label": "A",
      "title": "Multiple choice",
      "method": "omr_bubble_scan",
      "choice": {
        "rule": "all"
      },
      "items": [
        {
          "type": "question",
          "label": "1",
          "marks": 1,
          "question_id": null
        },
        {
          "type": "question",
          "label": "2",
          "marks": 1,
          "question_id": null
        },
        {
          "type": "question",
          "label": "3",
          "marks": 1,
          "question_id": null
        },
        {
          "type": "question",
          "label": "4",
          "marks": 1,
          "question_id": null
        },
        {
          "type": "question",
          "label": "5",
          "marks": 1,
          "question_id": null
        },
        {
          "type": "question",
          "label": "6",
          "marks": 1,
          "question_id": null
        },
        {
          "type": "question",
          "label": "7",
          "marks": 1,
          "question_id": null
        },
        {
          "type": "question",
          "label": "8",
          "marks": 1,
          "question_id": null
        },
        {
          "type": "question",
          "label": "9",
          "marks": 1,
          "question_id": null
        },
        {
          "type": "question",
          "label": "10",
          "marks": 1,
          "question_id": null
        }
      ]
    },
    {
      "label": "B",
      "title": "Numerical problems",
      "method": "keyword_formula",
      "choice": {
        "rule": "any",
        "n": 3
      },
      "items": [
        {
          "type": "question",
          "label": "11",
          "marks": 5,
          "question_id": null,
          "steps": [
            {
              "label": "Formula",
              "marks": 1
            },
            {
              "label": "Substitution",
              "marks": 2
            },
            {
              "label": "Answer",
              "marks": 2
            }
          ]
        },
        {
          "type": "question",
          "label": "12",
          "marks": 5,
          "question_id": null,
          "steps": [
            {
              "label": "Formula",
              "marks": 1
            },
            {
              "label": "Substitution",
              "marks": 2
            },
            {
              "label": "Answer",
              "marks": 2
            }
          ]
        },
        {
          "type": "question",
          "label": "13",
          "marks": 5,
          "question_id": null,
          "steps": [
            {
              "label": "Formula",
              "marks": 1
            },
            {
              "label": "Substitution",
              "marks": 2
            },
            {
              "label": "Answer",
              "marks": 2
            }
          ]
        },
        {
          "type": "question",
          "label": "14",
          "marks": 5,
          "question_id": null,
          "steps": [
            {
              "label": "Formula",
              "marks": 1
            },
            {
              "label": "Substitution",
              "marks": 2
            },
            {
              "label": "Answer",
              "marks": 2
            }
          ]
        }
      ]
    },
    {
      "label": "C",
      "title": "Diagram",
      "method": "diagram",
      "choice": {
        "rule": "all"
      },
      "items": [
        {
          "type": "question",
          "label": "15",
          "marks": 5,
          "question_id": null
        }
      ]
    }
  ]
}
