{
  "schema_version": "1.1",
  "title": "Synthetic paper, IPR shape",
  "course_code": "SYN-IPR",
  "exam_code": "IPR-2021-JUL",
  "subject_id": "00000000-0000-4000-8000-000000000001",
  "duration_minutes": 180,
  "total_marks": 60,
  "negative_marking": 0,
  "mark_step": 0.5,
  "sections": [
    {
      "label": "A",
      "title": "Short answers",
      "method": "keyword_formula",
      "choice": {
        "rule": "any",
        "n": 5
      },
      "items": [
        {
          "type": "question",
          "label": "1",
          "marks": 3,
          "question_id": null
        },
        {
          "type": "question",
          "label": "2",
          "marks": 3,
          "question_id": null
        },
        {
          "type": "question",
          "label": "3",
          "marks": 3,
          "question_id": null
        },
        {
          "type": "question",
          "label": "4",
          "marks": 3,
          "question_id": null
        },
        {
          "type": "question",
          "label": "5",
          "marks": 3,
          "question_id": null
        },
        {
          "type": "question",
          "label": "6",
          "marks": 3,
          "question_id": null
        },
        {
          "type": "question",
          "label": "7",
          "marks": 3,
          "question_id": null
        }
      ]
    },
    {
      "label": "B",
      "title": "Essays",
      "method": "semantic_rubric",
      "choice": {
        "rule": "any",
        "n": 3
      },
      "items": [
        {
          "type": "question",
          "label": "8",
          "marks": 10,
          "question_id": null
        },
        {
          "type": "question",
          "label": "9",
          "marks": 10,
          "question_id": null
        },
        {
          "type": "question",
          "label": "10",
          "marks": 10,
          "question_id": null
        },
        {
          "type": "question",
          "label": "11",
          "marks": 10,
          "question_id": null
        }
      ]
    },
    {
      "label": "C",
      "title": "Either Q12 or Q13",
      "method": "semantic_rubric",
      "choice": {
        "rule": "all"
      },
      "items": [
        {
          "type": "or",
          "alternatives": [
            {
              "label": "12",
              "marks": 15,
              "question_id": null,
              "parts": [
                {
                  "label": "a",
                  "marks": 10,
                  "question_id": null
                },
                {
                  "label": "b",
                  "marks": 5,
                  "question_id": null
                }
              ]
            },
            {
              "label": "13",
              "marks": 15,
              "question_id": null,
              "parts": [
                {
                  "label": "a",
                  "marks": 10,
                  "question_id": null
                },
                {
                  "label": "b",
                  "marks": 5,
                  "question_id": null
                }
              ]
            }
          ]
        }
      ]
    }
  ]
}
